Preguntas,Respuestas
Comprobantes Fiscales ¿Qué es un comprobante fiscal? ¿Qué es un NCF?,"El Comprobante Fiscal es un documento que acredita la transferencia de bienes, la entrega en uso, o la prestación
de servicios; y siempre debe cumplir con los requisitos establecidos por la normativa de Impuestos Internos vigente
que lo regula. Cada comprobante fiscal se identifica a través de un Número de Comprobante Fiscal (NCF), que es la secuencia alfanumérica (una letra y números) autorizada por Impuestos Internos."
Tipos de Comprobantes Fiscales  ¿Cuáles son los tipos de comprobantes fiscales?,"• Factura de Crédito Fiscal (Tipo B01, E31): registran las
transacciones comerciales de compra y venta de bienes
y/o servicios.
• Factura de Consumo (Tipo B02, E32): acreditan la
transferencia de bienes, la entrega en uso o la prestación
de servicios a consumidores finales.
• Notas de Débito (Tipo B03, E33): documentos que emiten
los vendedores de bienes y/o los que prestan servicios
para recuperar costos y gastos, como: intereses por mora,
fletes u otros, después de emitido el comprobante fiscal.
• Notas de Crédito (Tipo B04, E34): documentos que
emiten los vendedores de bienes y/ o prestadores de
servicios por modificaciones posteriores en las
condiciones de venta originalmente pactadas.
• Comprobante de Compras (Tipo B11, E41): este tipo de
comprobante especial deberá ser emitido por las personas
físicas o jurídicas cuando adquieran bienes o servicios de
personas no registradas como contribuyentes.

• Registro Único de Ingresos (Tipo B12): comprobante
utilizado para registrar un resumen de las transacciones
diarias realizadas por las personas físicas o jurídicas a
consumidores finales, cuyas ventas se concentran
fundamentalmente en productos o servicios exentos del
ITBIS.
Este podrá ser utilizado por los siguientes contribuyentes:
a) Estaciones de combustibles.
b) Colmados.
c) Venta de pasajes de transporte urbano e
interurbano.
d) Administradora de Fondos de Pensiones (AFPs).
e) Autorizados a realizar operaciones de compra y
venta de divisas.
f) Instituciones católicas y religiosas.


• Registro de Gastos Menores (Tipo B13, E43): este debe
ser emitido por los contribuyentes para sustentar pagos
realizados por su personal, sean éstos efectuados en
territorio dominicano o en el extranjero, y que estén
relacionados a su trabajo.

• Regímenes Especiales de Tributación (Tipo B14, E44):
son aquellos comprobantes utilizados para facturar las
ventas de bienes o prestación de servicios exentos del
Impuesto sobre Transferencia de Bienes Industrializados y
Servicios (ITBIS) y/o Impuesto Selectivo al Consumo (ISC) a
las personas físicas o jurídicas acogidas a regímenes
especiales de tributación mediante leyes especiales,
contratos o convenios debidamente ratificados por el
Congreso Nacional.

• Comprobantes Gubernamentales (Tipo B15, E45): son
aquellos comprobantes utilizados para registrar la venta
de bienes y la prestación de servicios a entidades
gubernamentales.

• Comprobante para Exportaciones (Tipo B16, E46): son
aquellos comprobantes utilizados para reportar las ventas
de bienes fuera del territorio nacional.
• Comprobante para Pagos al Exterior (Tipo B17, E47): Estos
serán emitidos al momento de efectuar pagos de rentas
gravadas de fuentes dominicanas a Personas Físicas o
Jurídicas no residentes en el país. Se debe retener el (27%)
correspondiente al Impuesto Sobre la Renta, según lo
establecido en los artículos 297 y 305 del Código Tributario"
Uso de los Comprobantes Fiscales ¿Cuál es el uso de los comprobantes fiscales? ¿Cuál es el uso de los NCF?,"Tanto las Personas Jurídicas como las Personas Físicas, al
momento de realizar venta de bienes o prestación de
servicios a sus clientes, deberán utilizar el tipo de
comprobante que aplique.

A los fines de justificar cualquier variación posterior a la
emisión de alguno de los comprobantes fiscales señalados
en los cuadros, se hace necesario que el contribuyente
posea los comprobantes fiscales denominados Nota de
Crédito y Nota de Débito."
