Preguntas,Respuestas
¿Puedo emitir un comprobante electrónico para exportaciones en un idioma diferente al español?,"Sí. Esta Dirección General no tiene objeción de que las facturas de exportación electrónicas sean emitidas a sus clientes en idiomas diferentes o en dos idiomas, siempre y cuando la factura que sea sometida en nuestro sistema sea en idioma español y cumpla con todas las estructura especificadas del XML."
¿Dónde puedo consultar el listado de Proveedores de Servicios de Facturación Electrónica y Emisores Autorizados?,"Puede consultar el listado de Proveedores de Servicios de Facturación Electrónica y Emisores Autorizados en la página web DGII, siguiendo estos pasos:

Ingrese a nuestra página web: www.dgii.gov.do.
En la sección Ciclo del Contribuyente, presione el botón Facturación.
Pulse la opción Facturación Electrónica.
Seleccione la opción Proveedores de Servicios de FE Autorizados o Emisores Autorizados para visualizar el listado (según corresponda).
Importante:

Estos listados son actualizados semanalmente.
Es obligación del Proveedor de Servicios de Facturación Electrónica mantener vigente su autorización como Emisor Electrónico, conforme a lo establecido en la Norma General núm. 01-2020 que regula la emisión y el uso de los Comprobantes Fiscales Electrónicos (e-CF) en el proceso de Facturación Electrónica, de fecha 09 de enero de 2020."
¿Qué grava el ITBIS?,"1) La transferencia de bienes industrializados.

2) La importación de bienes industrializados.

3) La prestación y la locación de servicios.


En la actualidad el reglamento del ITBIS es el decreto 293-11 es donde encontraremos todo lo referente a este impuesto y como se rige en la actualidad en el país, este decreto establece los bienes y servicios exentos, los gravados y los mecanismos para la declaración del impuesto. "
¿Cuáles son las marcas de Facturación Electrónica y qué significan?,"En facturación electronica existen las siguientes marcas:

La marca de Facturador Electrónico Transitorio es colocada en el Registro Nacional de Contribuyente (RNC) cuando el contribuyente concluye satisfactoriamente el proceso de certificación para ser emisor electrónico. Dado a que la facturación Electrónica en el país  se encuentra en una etapa de transición o voluntariedad, una vez colocada esta marca, el emisor electrónico se encuentra autorizado a emitir comprobantes fiscales electrónicos (e-CF) tanto serie letra “E” como la serie letra “B”. 2.
La marca de Facturador Gratuito es colocada en el Registro Nacional de Contribuyente (RNC) cuando el contribuyente solicita la autorización para utilizar el Facturador Gratuito de la DGII."
¿Qué debo hacer para migrar del Facturador Gratuito a un sistema propio o al de un Proveedor de Servicios de Facturación Electrónica?,Los contribuyentes que deseen migrar del Facturador Gratuito a un sistema propio o al de un Proveedor de Servicios de Facturación Electrónica deben solicitar la autorización para ser emisor electrónico.
¿Puede un mismo delegado con el rol de firmante ser delegado para varios contribuyentes diferentes?,"Sí, puede un mismo delegado con el rol de firmante ser delegado para varios contribuyentes diferentes, siempre y cuando se encuentre como delegado con el ""Rol de Firmante"" por cada emisor electrónico"
¿Qué debo hacer para cambiar la clave de acceso del facturador gratuito?,"Para cambiar la clave de acceso del facturador gratuito debe seguir estos pasos, según sea el caso:
 
Desde la página de inicio del portal FEG (sin ingresar con usuario y clave)

Ingrese al portal del Facturador Gratuito.
Presiona la opción ¿Olvidaste tu Contraseña?
Digite el RNC/Cédula Delegado y pulse el botón Restablecer. En caso de no recibirlo, puedes presionar el botón Reenviar.
Visualizará un mensaje indicándole que hemos enviado un mensaje al buzón de la Oficina Virtual (OFV) del delegado con un enlace para restablecer la contraseña.
Cuando reciba el mensaje, pulse el botón Restablecer Contraseña.
En el campo Nueva Contraseña, digite la nueva clave que utilizará para acceder, confirme la misma y presione el botón Guardar.

Desde dentro del portal del FEG

Ingrese al portal del Facturador Gratuito.
Digite las informaciones requeridas en los campos: RNC Empresa, RNC/Cédula Delegado y Contraseña y luego pulse el botón Acceder.
En la parte superior derecha, presione el botón Ajuste/Herramienta (el icono de la tuerca) y seleccione la opción Cambiar Contraseña.
Digite el RNC/Cédula Delegado y pulse el botón Restablecer. En caso de no recibirlo, puedes presionar el botón Reenviar.
Visualizará un mensaje indicándole que hemos enviado un mensaje al buzón de la Oficina Virtual (OFV) del delegado con un enlace para restablecer la contraseña.
Cuando reciba el mensaje, pulse el botón Restablecer Contraseña.
En el campo Nueva Contraseña, digite la nueva clave que utilizará para acceder, confirme la misma y presione el botón Guardar.
Importante:
El mensaje de recuperación de la clave le llegará al Buzón de Mensajes de la Oficina Virtual del delegado Administrador.

La contraseña debe ser reestablecida dentro de las 24 horas de recibido el mensaje."
¿Qué es la Representación Impresa (RI) de un e-CF?,"Es la versión impresa en papel del formato XML de un e-CF, que será entregada a receptores no electrónicos para que puedan reportar sus transacciones de compras ante la DGII, sustentar crédito fiscal o consumo, y conservar dichos documentos según lo establece la legislación vigente, como a quienes lo requieran.
 
Deberá contener todos los campos establecidos como obligatorios por el Decreto 254-06, según las especificaciones de la Norma General 06-2018.*
  
Consideraciones Importantes:

•Conforme lo establecido en el Artículo 10 de la Norma General 01-2020 que regula la Emisión y el uso de los Comprobantes Fiscales Electrónicos (e-CF) en el proceso de facturación electrónica “Todo receptor de e-CF no electrónico deberá exigir a su emisor electrónico una Representación Impresa (RI) del e-CF en el formato y en las condiciones dispuestas por la DGII. A tales fines, la representación impresa tendrá la misma validez que el documento electrónico válidamente emitido.

•* Si el contribuyente desea incluir campos adicionales, podrá hacerlo conforme lo indique la estructura del formato XML de e-CF.

Base Legal: Norma 01-2020, Art. 3, literal (f); Ley 32-23."
¿Qué es un certificado digital?,"Es un documento digital emitido y firmado digitalmente por una entidad de certificación, que identifica inequívocamente a un suscriptor durante el período de vigencia del certificado y que se constituye en prueba de que dicho suscriptor es fuente u originador del contenido de un documento digital o mensaje de datos que incorpore su certificado asociado."
¿Cómo puedo consultar el estatus de los NCF electrónicos (e-CF) a través de la página web de la DGII?,"Puede consultar el estatus de un NCF electrónicos (e-CF) a través de la página web, siguiendo estos pasos:

1. Ingrese a nuestra página web.
2. En la sección Herramientas, menú Consultas, seleccione la opción NCF / e-NCF .
3. Introduzca el RNC del contribuyente y el e-NCF que desea consultar, presione el botón Buscar.
4. Luego introduzca el RNC del comprador e ingrese el Código de Seguridad, sobre el cual desea realizar la consulta y presione el botón Consultar.
5. Visualizará en pantalla el estatus del e-CF consultado:

Aceptado: el e-CF fue aceptado, es válido para fines fiscales y las informaciones que contiene se presentan de forma íntegra y coherente.

Rechazado: el e-CF no es válido para fines fiscales. El mismo puede tener errores o no cumple con los requisitos especificados en el formato estándar que debe tener un Comprobante Fiscal Electrónico. Debe ponerse en contacto con el emisor del e-CF.

Comprobante Fiscal Electrónico no fue encontrado: Esta respuesta significa que la secuencia de e-NCF consultada es válida, pero que el e-CF como tal no ha sido recibido aún por DGII.

Importante:


Las informaciones requeridas se encuentran en la Representación Impresa (RI) que posee el contribuyente y es obligatorio para realizar la consulta del e-CF.

El código de seguridad está incorporado en la nueva versión de la RI, por tanto, este campo es obligatorio para aquellos contribuyentes que posean RI con la nueva versión que entró en vigor el 1 de diciembre del 2019.

Al realizar la consulta del e-CF se puede validar que la secuencia se encuentra autorizada, así como también las informaciones que contiene el documento completo.


También puede consultar los Comprobantes Fiscales Electrónicos (e-CF) por las siguientes vías:


• Servicio web de consulta de receptor.
• Consulta de código QR sobre cualquier Representación Impresa (RI) de un e-CF.
• Aplicación Móvil DGII

"
¿Qué es el Sistema Fiscal de Facturación Electrónica?,"El Sistema Fiscal de Facturación Electrónica es un sistema mediante el cual se validarán y acreditarán los comprobantes fiscales electrónicos que resulten de las facturas electrónicas emitidas en el país, así como aquellas formas jurídicas y documentos tributarios electrónicos que les modifican y que sirve de respaldo para sustentar gastos y créditos fiscales.

 

Este sistema es administrado por la Dirección General de Impuestos Internos, la cual tiene la responsabilidad de asegurar la integridad de las informaciones que acreditan los comprobantes fiscales electrónicos."
​​​​​​¿Qué es el ITBIS?,"Es un impuesto general al consumo tipo valor agregado que se aplica a la transferencia e importación de bienes industrializados, así como a la prestación de servicios. En otros países este impuesto es llamado Impuesto al Valor Agregado (IVA)."
"¿Quiénes pagan el ITBIS?
","Las personas físicas (profesionales liberales, negocios de único dueño) y personas jurídicas (SRL, EIRL y no lucrativas privadas), nacionales o extranjeras que realicen transferencias, importaciones o prestación de servicios gravados.

Las empresas públicas y privadas que realicen o no actividades gravadas, y estén en la obligación de realizar retenciones al ITBIS involucrado en los servicios que les son prestados por personas físicas, así como cuando paguen las prestaciones de servicios profesionales liberales y de alquiler de bienes muebles a otras sociedades con carácter lucrativo o no."
"¿Hay alguna exención para el pago de este impuesto?¿Que no pagana el ITBIS?
","Bienes y productos exentos​​:

Animales vivos.
Carnes frescas, refrigeradas y congeladas.
Pescado de consumo popular o reproducción.
Lácteos (excepto yogurt y mantequilla).
Leche y miel.
Otros productos de origen animal.
Plantas para siembra.
Legumbres, hortalizas, tubérculos sin procesar de consumo masivo.
Frutas sin procesar, de consumo masivo.
Café sin tostar, sin descafeinar, cáscara y cascarilla de café.
Cereales, harinas, granos trabajados.
Productos de molinería.
Semillas oleaginosas y otras semillas (para grasas, siembra o alimentos animales).
Embutidos.
Cacao en grano, entero o partido, crudo o tostado.
Cáscara, películas y demás residuos de cacao.
Servicios financieros, incluyendo seguros.
Servicios de planes de pensiones y jubilaciones.
Servicios de transporte terrestre de personas y de carga.
Servicios de electricidad, agua y recogida de basura.
Servicios de alquiler de viviendas.
Servicios de salud.
Servicios educativos y culturales.
Servicios funerarios.
Servicios de salones de belleza y peluquerías."
¿Cuál es la tasa que debo pagar por concepto del ITBIS?  ¿Cuál es la tasa del ITBIS?  ,"La tasa que debe pagar por concepto del Impuesto sobre Transferencia de Bienes
Industrializados y Servicios (ITBIS) es de un 18% del total del servicio prestado o bien
transferido.
En el caso de los productos gravados con la tasa reducida, la tasa a pagar es de un
16%."
¿Quiénes están obligados a pagar este impuesto? ¿Quiénes quienes tienen que pagar el ITBIS? ,"Las Personas Físicas (profesionales liberales, negocios de único dueño) y Personas
Jurídicas (SRL, EIRL y No Lucrativas Privadas), nacionales o extranjeras que realicen
transferencias, importaciones o prestación de servicios gravados.
Las empresas públicas y privadas, que realicen o no actividades gravadas, y estén en la
obligación de realizar retenciones al ITBIS involucrado en los servicios que les son
prestados por Personas Físicas, así como cuando paguen las prestaciones de servicios
profesionales liberales y de alquiler de bienes muebles a otras sociedades con carácter
lucrativo o no."
¿Cuál es la base imponible para el cálculo del ITBIS?,"La base imponible sobre la cual se debe calcular el ITBIS es la siguiente, según sea el
caso:
Transferencia de bienes industrializados: el precio neto de la transferencia
más las prestaciones accesorias que otorgue el vendedor, tales como:
transporte, embalaje, fletes e intereses por financiamientos, se facturen o no
por separado, más el importe de los impuestos selectivos que sean
aplicables, menos las bonificaciones y descuentos.
Importación de bienes: el resultado de agregar al valor definido para la
aplicación de los derechos arancelarios, todos los tributos a la importación o
con motivo de ella.
Prestación de servicios: el valor total de los servicios prestados, excluyendo
la propina obligatoria."
" ¿Cuáles productos se encuentran gravados con una tasa
reducida del ITBIS?  ¿Cuáles productos estan gravados 16% del ITBIS? ","Según lo establecido en la Ley No. 253-12, tienen una tasa reducida de un 16%, los
productos que se indican a continuación:
•Yogurt y mantequilla
•Café
•Grasas animales o vegetales comestibles
•Azúcares
•Cacao y Chocolate"
¿Qué es el ITBIS Retenido?,"El ITBIS Retenido o ITBIS a Terceros es el porcentaje del impuesto que el contribuyente
retiene por los pagos realizados por servicios o bienes recibidos provenientes de
Personas Físicas, Personas Jurídicas o Negocios de Único Dueño y personas no
registradas en Impuesto Internos. Este ITBIS cobrado deberá ser pagado a Impuestos
Internos de acuerdo a lo establecido legalmente."
¿Cuáles son las tasas de retención que se le aplican al ITBIS?,"• Un 30% del ITBIS facturado a Personas Jurídicas. Cuando las Personas Jurídicas o
sociedades de cualquier naturaleza paguen prestaciones de servicios profesionales
liberales o servicios de alquiler de bienes muebles a otras sociedades con carácter
lucrativo o no (Norma General No. 02-05 sobre Agentes de Retención del ITBIS).
•Un 100% del ITBIS facturado a Personas Jurídicas. Cuando las Personas Jurídicas o
sociedades de cualquier naturaleza paguen prestaciones de servicios de seguridad o
vigilancia a otras sociedades con carácter lucrativo o no (Norma General No. 07-09
que modifica la Norma General No. 02-05 sobre Agentes de Retención del ITBIS).
•Un 100% del ITBIS facturado a Personas Físicas. Cuando las Personas Jurídicas o
sociedades de cualquier naturaleza y los Negocios de Único Dueño paguen
prestaciones de servicios gravados a Personas Físicas (Art. 25 del Reglamento No.
293-11 del Título III del Código Tributario del ITBIS).
•Un 100% del ITBIS facturado a personas no registradas como contribuyentes.
Cuando las personas físicas y jurídicas adquieran bienes o servicios de personas no
registradas como contribuyentes y emitan un Comprobante de Compras para
sustentar dicho gasto (Norma General No. 05-19 sobre tipos de Comprobantes
Fiscales Especiales).
•Un 100% del ITBIS facturado a Instituciones Sin Fines de Lucro (ISFL). Cuando las
Personas Jurídicas o sociedades de cualquier naturaleza paguen servicios de
publicidad u otros servicios gravados por el ITBIS a entidades no lucrativas. (Norma
General No. 01-2011 sobre Retención del ITBIS en Servicios de Publicidad y otros
servicios gravados por el ITBIS prestados por Entidades No Lucrativas).
•Un 30% del ITBIS facturado en el pago con tarjetas de crédito y débito. Cuando
las compañías de adquirencia (administradoras de tarjetas de crédito y débito)
transparenten el valor del ITBIS en las transacciones a través de tarjetas de crédito o
débito realizadas en los establecimientos afiliados o el 2% sobre el valor total de
dichas transacciones (Norma General No. 08-04 sobre retención de ITBIS)."
¿Cuáles bienes se encuentran exentos del pago del ITBIS? ¿Cuáles son los productos exentos del pago del ITBIS? ,"•Animales vivos
•Carnes frescas, refrigeradas y congeladas
•Pescado de consumo popular o reproducción
•Lácteos (excepto yogurt y mantequilla)
•Leche y miel
•Otros productos de origen animal
•Plantas para siembra
•Legumbres, hortalizas, tubérculos sin procesar de consumo masivo
•Frutas sin procesar, de consumo masivo
•Café sin tostar, sin descafeinar, cáscara y cascarilla de café
•Cereales, harinas, granos trabajados
•Productos de molinería
•Semillas oleaginosas y otras semillas (para grasas, siembra o alimentos animales)
•Embutidos
•Cacao en grano, entero o partido, crudo o tostado y cáscara, películas y demás
residuos de cacao
•Alimentos infantiles, pastas, pan
•Agua natural y agua mineral natural embotellada o no
•Insumos pecuaria
•Combustibles
•Medicamentos
•Abonos y sus componentes
•Insecticidas, raticidas y demás antirroedores, fungicidas, herbicidas
•Otros insumos o bienes de capital agropecuarios
•Libros y revistas
•Material educativo a nivel preuniversitario
•Sillones de rueda y demás vehículos para inválidos
•Prótesis articulares
"
¿Cuáles servicios se encuentran exentos del pago del ITBIS? ¿Qué servicios están exentos del ITBIS?,"Se encuentran exentos del pago del Impuesto sobre Transferencias de Bienes
Industrializados y Servicios (ITBIS), los siguientes servicios:
•Servicios financieros, incluyendo seguros.
•Servicios de planes de pensiones y jubilaciones.
•Servicios de transporte terrestre de personas y de carga.
•Servicios de electricidad, agua y recogida de basura.
•Servicios de alquiler de viviendas.
•Servicios de salud.
•Servicios educativos y culturales.
•Servicios funerarios.
•Servicios de salones de belleza y peluquerías.
Consideraciones Importantes:
•Los gimnasios y los servicios odontológicos están considerados como servicios
preventivos de salud y por tanto exentos de la aplicación y pago del ITBIS.
•Los espectáculos artísticos, ya sean clásicos o populares y las presentaciones de
artistas, músicos, obras teatrales, ballets y títeres se encuentran exentos del
ITBIS.
•Los servicios exportados se encuentran exentos del pago del ITBIS, siempre y
cuando sean prestados desde el territorio dominicano para ser utilizados y
consumidos exclusivamente en el exterior por personas físicas o jurídica no
domiciliada ni residente en la Republica dominicana. El pago del servicio debe ser
con renta de fuente extranjera y no puede afectar renta ni gastos en República
Dominicana. "
¿La venta de inmuebles está gravada con el ITBIS? ¿Si vendo una casa está exenta de ITBIS?,"No, la transferencia de bienes inmuebles, tales como terrenos, fincas, casas,
apartamentos y locales comerciales, en lo referente exclusivamente al terreno y a las
mejoras construidas, incluyendo inmuebles por destino o naturaleza, definidos en los
artículos 517 y siguientes del Código Civil no constituyen hechos gravados con este
impuesto."
¿Cuáles materiales de construcción se encuentran exentos del pago del ITBIS?,"Los materiales de construcción que se encuentran exentos del pago del ITBIS son la arena, la grava y el caliche ó terreno arcilloso, siempre y cuando se comercialicen en estado natural, es decir, que no implique en modo alguno el someterle a algún proceso de transformación."
¿Los equipos médicos están exentos del ITBIS?,"Se encuentran exentas del pago del ITBIS las importaciones y adquisiciones en el
mercado local de maquinarias y equipos relacionados con la fabricación o producción
de medicinas para uso humano y animal, así como sus repuestos.
"
¿La compra de materiales educativos se encuentra exenta del pago del ITBIS?,"Sí, la compra de materiales educativos, libros y revistas se encuentra exenta del pago
del ITBIS."
"¿La adquisición de licencias de softwares o programas
computacionales se encuentran gravadas con el ITBIS?","No, las transferencias de derechos de autor, propiedad industrial, permisos, licencias y
otros derechos que no impliquen la transmisión de un bien corporal, no están
gravados con el ITBIS, de conformidad con lo establecido en los literales c y d del
artículo 4 del Reglamento 293-11."
¿Como se calcula el ITBIS?,"la tasa que debes pagar por concepto del Impuesto a la Transferencia de Bienes Industrializados y Servicios (ITBIS) es de un 18% del total del servicio prestado o bien transferido.

En el caso de los productos gravados con la tasa reducida, la tasa a pagar es de un 16%.

La base imponible sobre la cual debes calcular el ITBIS es la siguiente, según sea el caso:

Transferencia de bienes industrializados: el precio neto de la transferencia más las prestaciones accesorias que otorgue el vendedor, tales como: transporte, embalaje, fletes e intereses por financiamientos, se facturen o no por separado, más el importe de los impuestos selectivos que sean aplicables, menos las bonificaciones y descuentos.


Importación de bienes: el resultado de agregar al valor definido para la aplicación de los derechos arancelarios, todos los tributos a la importación o con motivo de ella.


Prestación de servicios: el valor total de los servicios prestados, excluyendo la propina obligatoria."
"¿Qué es el Registro Nacional de
Contribuyentes (RNC)? ¿Qué es un RNC?","Es el registro que contiene la información relacionada a la identificación, domicilio y actividad
económica de las personas físicas y jurídicas inscritas en Impuestos Internos, ya sea para fines
tributarios o para registro de patrimonios y otras ocupaciones. Cuando una persona se inscribe al
RNC, Impuestos Internos le otorga un código único y permanente de identificación llamado “número de
RNC”. "
"¿Quiénes deben inscribirse en el RNC
como contribuyente?","Están obligados a inscribirse en calidad de contribuyentes o responsables:
Las Personas Físicas (profesionales y personas que prestan servicios de manera independiente).
Las Personas Jurídicas (sociedades comerciales legalmente constituidas, sociedades extranjeras, Instituciones sin
Fines de Lucro, sociedades con personería jurídica en virtud de leyes especiales).
Sucesiones indivisas que presten servicios en territorio dominicano.
Entidades sin Personalidad jurídica, tales como Fideicomisos y consorcios.

El número de RNC para Personas Físicas es igual al número de su Cédula de Identidad y el de las
Personas Jurídicas y extranjeros sin cédula es una numeración de 9 dígitos asignada por Impuestos
Internos.
"
¿Cómo se obtiene el RNC de contribuyente?,"Puede solicitar la inscripción al RNC a través de las siguientes vías:
1. Por la Oficina Virtual de Impuestos Internos, en la opción “Inscripción y
Actualización al RNC”, llenando la solicitud en línea.
2. Ventanilla Única: Es una herramienta por la cual puede realizar el proceso de
formalización a través de una sola solicitud, vía el portal www.formalizate.gob.do del Ministerio de
Industria, Comercio y MiPymes.
3. De manera presencial, en una Administración Local (oficinas de Impuestos Internos) completando los
siguientes documentos:

a) Persona Física: Formulario de Declaración Jurada de Registro y Actualización de Datos de Personas
Físicas (RC-01) llenado y firmado, especificando el código y descripción de la actividad, conforme el
catálogo de Clasificación Internacional Industrial Uniforme (CIIU). Adjuntando los demás requisitos
que apliquen según el tipo de solicitud.

b) Persona Jurídica: Formulario de Declaración Jurada de Registro y Actualización de Datos de
Personas Jurídicas o entes sin Personalidad Jurídica (RC-02) llenado, firmado y sellado (no obligatorio),
especificando el código y descripción de la actividad, conforme el catálogo de Clasificación
Internacional Industrial Uniforme (CIIU). Adjuntando los demás requisitos que apliquen según el tipo de
solicitud.

c) Patrimonios separados: Formulario de Declaración Jurada de Registro y Actualización de
Datos de Patrimonios Separados (RC-03) llenado, firmado y sellado (no obligatorio), especificando el
código y descripción de la actividad, conforme el catálogo de Clasificación Internacional Industrial
Uniforme (CIIU). Adjuntando los demás requisitos
que apliquen según el tipo de solicitud.

Importante: Si necesita ayuda para identificar la actividad económica que le corresponde, puede
consultar el “Instructivo Consulta de Actividades Económicas”, publicado en la Biblioteca Virtual, en
el portal web www.dgii.gov.do. Para completar su proceso de inscripción al RNC, el contribuyente, socio, accionista o miembro del
consejo de administración deberá firmar el formulario de registro y/o el Acta de Inscripción
al RNC en el Centro de Asistencia al Contribuyente o en la Administración Local más
cercana. El formulario firmado podrá ser depositado por un representante debidamente apoderado. "
¿Dónde debe aparecer el RNC?,"El número de RNC debe aparecer de manera visible y claramente identificable en todos los documentos
impresos que el contribuyente utilice en sus operaciones, tales como:
Papeles con membrete
Comprobantes Fiscales
Órdenes de compra o pedidos
Entre otros"
